{
  "patchVersion": 1,
  "baseRevision": "<from_current_snapshot>",
  "baseChecksum": "<from_current_snapshot>",
  "changes": [{
    "type": "upsert_bot_spec_entry",
    "section": "content",
    "key": "confirmation",
    "value": {
      "format": "plain",
      "text": "Заявка принята. Мы свяжемся с вами.",
      "variables": { "required": [], "optional": [] }
    }
  }]
}
